<?xml version="1.0" encoding="UTF-8"?>
<root xmlns:xsi="http://www.w3.org/2001/XMLSchema-instance" xsi:noNamespaceSchemaLocation="../plant_model.xsd">
    <ProductiveStructure>
        <flows>
            <key>G1</key>
            <type>RESOURCE</type>
        </flows>
        <flows>
            <key>G2</key>
            <type>INTERNAL</type>
        </flows>
        <flows>
            <key>G3</key>
            <type>INTERNAL</type>
        </flows>
        <flows>
            <key>G4</key>
            <type>INTERNAL</type>
        </flows>
        <flows>
            <key>G5</key>
            <type>INTERNAL</type>
        </flows>
        <flows>
            <key>G6</key>
            <type>INTERNAL</type>
        </flows>
        <flows>
            <key>G7</key>
            <type>INTERNAL</type>
        </flows>
        <flows>
            <key>G8</key>
            <type>INTERNAL</type>
        </flows>
        <flows>
            <key>V1</key>
            <type>INTERNAL</type>
        </flows>
        <flows>
            <key>V2</key>
            <type>INTERNAL</type>
        </flows>
        <flows>
            <key>V3</key>
            <type>INTERNAL</type>
        </flows>
        <flows>
            <key>V4</key>
            <type>INTERNAL</type>
        </flows>
        <flows>
            <key>WAC</key>
            <type>INTERNAL</type>
        </flows>
        <flows>
            <key>WGT</key>
            <type>INTERNAL</type>
        </flows>
        <flows>
            <key>WST</key>
            <type>INTERNAL</type>
        </flows>
        <flows>
            <key>WCP</key>
            <type>INTERNAL</type>
        </flows>
        <flows>
            <key>GN</key>
            <type>RESOURCE</type>
        </flows>
        <flows>
            <key>WN</key>
            <type>OUTPUT</type>
        </flows>
        <flows>
            <key>COLD</key>
            <type>OUTPUT</type>
        </flows>
        <flows>
            <key>HEAT</key>
            <type>OUTPUT</type>
        </flows>
        <flows>
            <key>G9</key>
            <type>WASTE</type>
        </flows>
        <flows>
            <key>QCON</key>
            <type>WASTE</type>
        </flows>
        <processes>
            <key>AC</key>
            <description>Air Compressor</description>
            <fuel>WAC</fuel>
            <product>G2-G1</product>
            <type>PRODUCTIVE</type>
        </processes>
        <processes>
            <key>CC</key>
            <description>Combustion chamber</description>
            <fuel>GN</fuel>
            <product>G3-G2</product>
            <type>PRODUCTIVE</type>
        </processes>
        <processes>
            <key>GT</key>
            <description>Gas Turbine</description>
            <fuel>G3-G4-G6</fuel>
            <product>WGT+WAC</product>
            <type>PRODUCTIVE</type>
        </processes>
        <processes>
            <key>HRSG</key>
            <description>HRSG</description>
            <fuel>G4-G5</fuel>
            <product>V1-V4</product>
            <type>PRODUCTIVE</type>
        </processes>
        <processes>
            <key>ST</key>
            <description>Steam Turbine</description>
            <fuel>V1-V2</fuel>
            <product>WST</product>
            <type>PRODUCTIVE</type>
        </processes>
        <processes>
            <key>CP</key>
            <description>Condenser pump</description>
            <fuel>WCP</fuel>
            <product>V4-V3</product>
            <type>PRODUCTIVE</type>
        </processes>
        <processes>
            <key>GEN</key>
            <description>Generator</description>
            <fuel>WGT+WST</fuel>
            <product>WN+WCP</product>
            <type>PRODUCTIVE</type>
        </processes>
        <processes>
            <key>REF</key>
            <description>Refrigerator</description>
            <fuel>G6-G7</fuel>
            <product>COLD</product>
            <type>PRODUCTIVE</type>
        </processes>
        <processes>
            <key>HE</key>
            <description>Heater</description>
            <fuel>G7-G8</fuel>
            <product>HEAT</product>
            <type>PRODUCTIVE</type>
        </processes>
        <processes>
            <key>STCK</key>
            <description>Stack</description>
            <fuel>G5+G8</fuel>
            <product>G9</product>
            <type>DISSIPATIVE</type>
        </processes>
        <processes>
            <key>CND</key>
            <description>Condenser</description>
            <fuel>V2-V3</fuel>
            <product>QCON</product>
            <type>DISSIPATIVE</type>
        </processes>
    </ProductiveStructure>
    <ExergyStates>
        <States state="Reference">
            <exergy>
                <key>G1</key>
                <value>0</value>
            </exergy>
            <exergy>
                <key>G2</key>
                <value>251434.7398</value>
            </exergy>
            <exergy>
                <key>G3</key>
                <value>800981.4355</value>
            </exergy>
            <exergy>
                <key>G4</key>
                <value>238347.4756</value>
            </exergy>
            <exergy>
                <key>G5</key>
                <value>17248.7222</value>
            </exergy>
            <exergy>
                <key>G6</key>
                <value>2973.558</value>
            </exergy>
            <exergy>
                <key>G7</key>
                <value>467.4062</value>
            </exergy>
            <exergy>
                <key>G8</key>
                <value>241.364</value>
            </exergy>
            <exergy>
                <key>V1</key>
                <value>170942.3944</value>
            </exergy>
            <exergy>
                <key>V2</key>
                <value>14770.3667</value>
            </exergy>
            <exergy>
                <key>V3</key>
                <value>18.4333</value>
            </exergy>
            <exergy>
                <key>V4</key>
                <value>257.9569</value>
            </exergy>
            <exergy>
                <key>WAC</key>
                <value>261432.5</value>
            </exergy>
            <exergy>
                <key>WGT</key>
                <value>256695.1</value>
            </exergy>
            <exergy>
                <key>WST</key>
                <value>141167.47</value>
            </exergy>
            <exergy>
                <key>WCP</key>
                <value>384.03</value>
            </exergy>
            <exergy>
                <key>GN</key>
                <value>718204.1</value>
            </exergy>
            <exergy>
                <key>WN</key>
                <value>389521.2886</value>
            </exergy>
            <exergy>
                <key>COLD</key>
                <value>500.991</value>
            </exergy>
            <exergy>
                <key>HEAT</key>
                <value>91.361</value>
            </exergy>
            <exergy>
                <key>G9</key>
                <value>17490.0862</value>
            </exergy>
            <exergy>
                <key>QCON</key>
                <value>14751.9333</value>
            </exergy>
        </States>
    </ExergyStates>
    <WasteDefinition>
        <wastes>
            <flow>G9</flow>
            <type>MANUAL</type>
            <recycle>0</recycle>
            <values>
                <process>CC</process>
                <value>1</value>
            </values>
        </wastes>
        <wastes>
            <flow>QCON</flow>
            <type>MANUAL</type>
            <recycle>0</recycle>
            <values>
                <process>HRSG</process>
                <value>1</value>
            </values>
        </wastes>
    </WasteDefinition>
    <Format>
        <definitions>
            <key>EXERGY</key>
            <width>11</width>
            <precision>1</precision>
            <unit>(kW)</unit>
        </definitions>
        <definitions>
            <key>EXERGY_COST</key>
            <width>11</width>
            <precision>1</precision>
            <unit>(kW)</unit>
        </definitions>
        <definitions>
            <key>EXERGY_UNIT_COST</key>
            <width>10</width>
            <precision>4</precision>
            <unit>(J/J)</unit>
        </definitions>
        <definitions>
            <key>GENERALIZED_COST</key>
            <width>10</width>
            <precision>1</precision>
            <unit>(kW)</unit>
        </definitions>
        <definitions>
            <key>GENERALIZED_UNIT_COST</key>
            <width>10</width>
            <precision>4</precision>
            <unit>(J/J)</unit>
        </definitions>
        <definitions>
            <key>DIAGNOSIS</key>
            <width>11</width>
            <precision>2</precision>
            <unit>(kW)</unit>
        </definitions>
    </Format>
</root>
