<?xml version="1.0" encoding="UTF-8"?>
<root xmlns:xsi="http://www.w3.org/2001/XMLSchema-instance" xsi:noNamespaceSchemaLocation="../plant_model.xsd">
    <ProductiveStructure>
        <flows>
            <key>B1</key>
            <type>INTERNAL</type>
        </flows>
        <flows>
            <key>B2</key>
            <type>INTERNAL</type>
        </flows>
        <flows>
            <key>B3</key>
            <type>INTERNAL</type>
        </flows>
        <flows>
            <key>B4</key>
            <type>INTERNAL</type>
        </flows>
        <flows>
            <key>B5</key>
            <type>INTERNAL</type>
        </flows>
        <flows>
            <key>B6</key>
            <type>INTERNAL</type>
        </flows>
        <flows>
            <key>B7</key>
            <type>INTERNAL</type>
        </flows>
        <flows>
            <key>B8</key>
            <type>INTERNAL</type>
        </flows>
        <flows>
            <key>B9</key>
            <type>INTERNAL</type>
        </flows>
        <flows>
            <key>B10</key>
            <type>INTERNAL</type>
        </flows>
        <flows>
            <key>B11</key>
            <type>INTERNAL</type>
        </flows>
        <flows>
            <key>B12</key>
            <type>INTERNAL</type>
        </flows>
        <flows>
            <key>B13</key>
            <type>INTERNAL</type>
        </flows>
        <flows>
            <key>B14</key>
            <type>OUTPUT</type>
        </flows>
        <flows>
            <key>B15</key>
            <type>RESOURCE</type>
        </flows>
        <flows>
            <key>B16</key>
            <type>WASTE</type>
        </flows>
        <processes>
            <key>BOIL</key>
            <description>Boiler</description>
            <fuel>B15</fuel>
            <product>(B1-B8)+(B3-B2)</product>
            <type>PRODUCTIVE</type>
        </processes>
        <processes>
            <key>HTRB</key>
            <description>HP Turbine</description>
            <fuel>B1-B2-B9</fuel>
            <product>B10</product>
            <type>PRODUCTIVE</type>
        </processes>
        <processes>
            <key>LTRB</key>
            <description>LP Turbine</description>
            <fuel>B3-B4</fuel>
            <product>B11</product>
            <type>PRODUCTIVE</type>
        </processes>
        <processes>
            <key>LPMP</key>
            <description>LP Pump</description>
            <fuel>B12</fuel>
            <product>B6-B5</product>
            <type>PRODUCTIVE</type>
        </processes>
        <processes>
            <key>DRTR</key>
            <description>Dereator</description>
            <fuel>B6+B9</fuel>
            <product>B7</product>
            <type>PRODUCTIVE</type>
        </processes>
        <processes>
            <key>HPMP</key>
            <description>LP Pump</description>
            <fuel>B13</fuel>
            <product>B8-B7</product>
            <type>PRODUCTIVE</type>
        </processes>
        <processes>
            <key>GEN</key>
            <description>Generator</description>
            <fuel>B10+B11</fuel>
            <product>B12+B13+B14</product>
            <type>PRODUCTIVE</type>
        </processes>
        <processes>
            <key>COND</key>
            <description>Condenser</description>
            <fuel>B4-B5</fuel>
            <product>B16</product>
            <type>DISSIPATIVE</type>
        </processes>
    </ProductiveStructure>
    <ExergyStates>
        <States state="Reference">
            <exergy>
                <key>B1</key>
                <value>51121</value>
            </exergy>
            <exergy>
                <key>B2</key>
                <value>35868</value>
            </exergy>
            <exergy>
                <key>B3</key>
                <value>42109</value>
            </exergy>
            <exergy>
                <key>B4</key>
                <value>5459</value>
            </exergy>
            <exergy>
                <key>B5</key>
                <value>118.7</value>
            </exergy>
            <exergy>
                <key>B6</key>
                <value>218.6</value>
            </exergy>
            <exergy>
                <key>B7</key>
                <value>2359</value>
            </exergy>
            <exergy>
                <key>B8</key>
                <value>2639</value>
            </exergy>
            <exergy>
                <key>B9</key>
                <value>4696</value>
            </exergy>
            <exergy>
                <key>B10</key>
                <value>9739</value>
            </exergy>
            <exergy>
                <key>B11</key>
                <value>31517</value>
            </exergy>
            <exergy>
                <key>B12</key>
                <value>115.9</value>
            </exergy>
            <exergy>
                <key>B13</key>
                <value>314.6</value>
            </exergy>
            <exergy>
                <key>B14</key>
                <value>40000</value>
            </exergy>
            <exergy>
                <key>B15</key>
                <value>129713</value>
            </exergy>
            <exergy>
                <key>B16</key>
                <value>5340</value>
            </exergy>
        </States>
        <States state="Operation">
            <exergy>
                <key>B1</key>
                <value>49259</value>
            </exergy>
            <exergy>
                <key>B2</key>
                <value>36252</value>
            </exergy>
            <exergy>
                <key>B3</key>
                <value>42560</value>
            </exergy>
            <exergy>
                <key>B4</key>
                <value>5517</value>
            </exergy>
            <exergy>
                <key>B5</key>
                <value>120</value>
            </exergy>
            <exergy>
                <key>B6</key>
                <value>220.9</value>
            </exergy>
            <exergy>
                <key>B7</key>
                <value>1269</value>
            </exergy>
            <exergy>
                <key>B8</key>
                <value>1530</value>
            </exergy>
            <exergy>
                <key>B9</key>
                <value>2835</value>
            </exergy>
            <exergy>
                <key>B10</key>
                <value>9384</value>
            </exergy>
            <exergy>
                <key>B11</key>
                <value>31854</value>
            </exergy>
            <exergy>
                <key>B12</key>
                <value>117.2</value>
            </exergy>
            <exergy>
                <key>B13</key>
                <value>296.3</value>
            </exergy>
            <exergy>
                <key>B14</key>
                <value>40000</value>
            </exergy>
            <exergy>
                <key>B15</key>
                <value>130587</value>
            </exergy>
            <exergy>
                <key>B16</key>
                <value>5397</value>
            </exergy>
        </States>
    </ExergyStates>
</root>