<?xml version="1.0" encoding="UTF-8"?>
<root xmlns:xsi="http://www.w3.org/2001/XMLSchema-instance" xsi:noNamespaceSchemaLocation="../plant_model.xsd">
    <ProductiveStructure>
        <flows>
            <key>B1</key>
            <type>RESOURCE</type>
        </flows>
        <flows>
            <key>B2</key>
            <type>INTERNAL</type>
        </flows>
        <flows>
            <key>B3</key>
            <type>INTERNAL</type>
        </flows>
        <flows>
            <key>B4</key>
            <type>RESOURCE</type>
        </flows>
        <flows>
            <key>B5</key>
            <type>INTERNAL</type>
        </flows>
        <flows>
            <key>B6</key>
            <type>INTERNAL</type>
        </flows>
        <flows>
            <key>B7</key>
            <type>INTERNAL</type>
        </flows>
        <flows>
            <key>B8</key>
            <type>OUTPUT</type>
        </flows>
        <flows>
            <key>B9</key>
            <type>INTERNAL</type>
        </flows>
        <flows>
            <key>B10</key>
            <type>RESOURCE</type>
        </flows>
        <flows>
            <key>B11</key>
            <type>INTERNAL</type>
        </flows>
        <flows>
            <key>B12</key>
            <type>OUTPUT</type>
        </flows>
        <flows>
            <key>B13</key>
            <type>INTERNAL</type>
        </flows>
        <flows>
            <key>B14</key>
            <type>INTERNAL</type>
        </flows>
        <flows>
            <key>B15</key>
            <type>RESOURCE</type>
        </flows>
        <flows>
            <key>B16</key>
            <type>INTERNAL</type>
        </flows>
        <flows>
            <key>B17</key>
            <type>OUTPUT</type>
        </flows>
        <flows>
            <key>B18</key>
            <type>OUTPUT</type>
        </flows>
        <flows>
            <key>B19</key>
            <type>INTERNAL</type>
        </flows>
        <flows>
            <key>B20</key>
            <type>WASTE</type>
        </flows>
        <processes>
            <key>COMB</key>
            <description>Combustor</description>
            <fuel>B4</fuel>
            <product>B5-B3</product>
            <type>PRODUCTIVE</type>
        </processes>
        <processes>
            <key>REGE</key>
            <description>Regenerator</description>
            <fuel>B6-B9</fuel>
            <product>B3-B2</product>
            <type>PRODUCTIVE</type>
        </processes>
        <processes>
            <key>COMP</key>
            <description>Compressor</description>
            <fuel>B7</fuel>
            <product>B2-B1</product>
            <type>PRODUCTIVE</type>
        </processes>
        <processes>
            <key>TURB</key>
            <description>Turbine</description>
            <fuel>B5-B6</fuel>
            <product>B7+B8</product>
            <type>PRODUCTIVE</type>
        </processes>
        <processes>
            <key>ICE</key>
            <description>ICE</description>
            <fuel>B10</fuel>
            <product>B11+B12+(B13-B14)</product>
            <type>PRODUCTIVE</type>
        </processes>
        <processes>
            <key>WHTR</key>
            <description>Water Heater</description>
            <fuel>B13-B14</fuel>
            <product>B17</product>
            <type>PRODUCTIVE</type>
        </processes>
        <processes>
            <key>BURN</key>
            <description>Burner</description>
            <fuel>B15</fuel>
            <product>B16-B11</product>
            <type>PRODUCTIVE</type>
        </processes>
        <processes>
            <key>HRSG</key>
            <description>HRSG</description>
            <fuel>B16+B9-B19</fuel>
            <product>B18</product>
            <type>PRODUCTIVE</type>
        </processes>
        <processes>
            <key>STCK</key>
            <description>Stack</description>
            <fuel>B19</fuel>
            <product>B20</product>
            <type>DISSIPATIVE</type>
        </processes>
    </ProductiveStructure>
    <ExergyStates>
        <States state="Reference">
            <exergy>
                <key>B1</key>
                <value>0</value>
            </exergy>
            <exergy>
                <key>B2</key>
                <value>26204</value>
            </exergy>
            <exergy>
                <key>B3</key>
                <value>41732</value>
            </exergy>
            <exergy>
                <key>B4</key>
                <value>78643</value>
            </exergy>
            <exergy>
                <key>B5</key>
                <value>94210</value>
            </exergy>
            <exergy>
                <key>B6</key>
                <value>33696</value>
            </exergy>
            <exergy>
                <key>B7</key>
                <value>27939</value>
            </exergy>
            <exergy>
                <key>B8</key>
                <value>30000</value>
            </exergy>
            <exergy>
                <key>B9</key>
                <value>16271</value>
            </exergy>
            <exergy>
                <key>B10</key>
                <value>27568</value>
            </exergy>
            <exergy>
                <key>B11</key>
                <value>3949</value>
            </exergy>
            <exergy>
                <key>B12</key>
                <value>10000</value>
            </exergy>
            <exergy>
                <key>B13</key>
                <value>3116</value>
            </exergy>
            <exergy>
                <key>B14</key>
                <value>2357</value>
            </exergy>
            <exergy>
                <key>B15</key>
                <value>10717</value>
            </exergy>
            <exergy>
                <key>B16</key>
                <value>10073</value>
            </exergy>
            <exergy>
                <key>B17</key>
                <value>375</value>
            </exergy>
            <exergy>
                <key>B18</key>
                <value>14060</value>
            </exergy>
            <exergy>
                <key>B19</key>
                <value>4129</value>
            </exergy>
            <exergy>
                <key>B20</key>
                <value>4129</value>
            </exergy>
        </States>
    </ExergyStates>
    <WasteDefinition>
        <wastes>
            <flow>B20</flow>
            <type>DEFAULT</type>
            <recycle>0</recycle>
        </wastes>
    </WasteDefinition>
    <ResourcesCost>
        <Samples sample="Base">
            <flows>
                <key>B4</key>
                <value>1.284</value>
            </flows>
            <flows>
                <key>B10</key>
                <value>1.475</value>
            </flows>
            <flows>
                <key>B15</key>
                <value>1.346</value>
            </flows>
        </Samples>
    </ResourcesCost>
</root>
