<?xml version="1.0" encoding="UTF-8"?>
<root xmlns:xsi="http://www.w3.org/2001/XMLSchema-instance" xsi:noNamespaceSchemaLocation="../plant_model.xsd">
    <ProductiveStructure>
        <flows>
            <key>B1</key>
            <type>INTERNAL</type>
        </flows>
        <flows>
            <key>B2</key>
            <type>INTERNAL</type>
        </flows>
        <flows>
            <key>B3</key>
            <type>INTERNAL</type>
        </flows>
        <flows>
            <key>B4</key>
            <type>INTERNAL</type>
        </flows>
        <flows>
            <key>B5</key>
            <type>INTERNAL</type>
        </flows>
        <flows>
            <key>B6</key>
            <type>INTERNAL</type>
        </flows>
        <flows>
            <key>B7</key>
            <type>INTERNAL</type>
        </flows>
        <flows>
            <key>AIR</key>
            <type>RESOURCE</type>
        </flows>
        <flows>
            <key>WT</key>
            <type>INTERNAL</type>
        </flows>
        <flows>
            <key>WBC</key>
            <type>INTERNAL</type>
        </flows>
        <flows>
            <key>WBA</key>
            <type>INTERNAL</type>
        </flows>
        <flows>
            <key>COMB</key>
            <type>RESOURCE</type>
        </flows>
        <flows>
            <key>WN</key>
            <type>OUTPUT</type>
        </flows>
        <flows>
            <key>QCON</key>
            <type>WASTE</type>
        </flows>
        <processes>
            <key>CALD</key>
            <description>Caldera</description>
            <fuel>COMB+AIR</fuel>
            <product>B1-B7</product>
            <type>PRODUCTIVE</type>
        </processes>
        <processes>
            <key>TURB</key>
            <description>Turbina</description>
            <fuel>B1-B2-B3</fuel>
            <product>WT</product>
            <type>PRODUCTIVE</type>
        </processes>
        <processes>
            <key>BC</key>
            <description>Bomba Condensados</description>
            <fuel>WBC</fuel>
            <product>B5-B4</product>
            <type>PRODUCTIVE</type>
        </processes>
        <processes>
            <key>DESG</key>
            <description>Desgasificador</description>
            <fuel>B2+B5</fuel>
            <product>B6</product>
            <type>PRODUCTIVE</type>
        </processes>
        <processes>
            <key>BA</key>
            <description>Bomba Alimentacion</description>
            <fuel>WBA</fuel>
            <product>B7-B6</product>
            <type>PRODUCTIVE</type>
        </processes>
        <processes>
            <key>GEN</key>
            <description>Generador</description>
            <fuel>WT</fuel>
            <product>WN+WBC+WBA</product>
            <type>PRODUCTIVE</type>
        </processes>
        <processes>
            <key>COND</key>
            <description>Condensador</description>
            <fuel>B3-B4</fuel>
            <product>QCON</product>
            <type>DISSIPATIVE</type>
        </processes>
    </ProductiveStructure>
    <ExergyStates>
        <States state="Reference">
            <exergy>
                <key>B1</key>
                <value>146374</value>
            </exergy>
            <exergy>
                <key>B2</key>
                <value>16956</value>
            </exergy>
            <exergy>
                <key>B3</key>
                <value>12183</value>
            </exergy>
            <exergy>
                <key>B4</key>
                <value>256.9</value>
            </exergy>
            <exergy>
                <key>B5</key>
                <value>315.6</value>
            </exergy>
            <exergy>
                <key>B6</key>
                <value>12147</value>
            </exergy>
            <exergy>
                <key>B7</key>
                <value>12993</value>
            </exergy>
            <exergy>
                <key>AIR</key>
                <value>0</value>
            </exergy>
            <exergy>
                <key>WT</key>
                <value>102964</value>
            </exergy>
            <exergy>
                <key>WBC</key>
                <value>58.7</value>
            </exergy>
            <exergy>
                <key>WBA</key>
                <value>846</value>
            </exergy>
            <exergy>
                <key>COMB</key>
                <value>325246</value>
            </exergy>
            <exergy>
                <key>WN</key>
                <value>100000</value>
            </exergy>
            <exergy>
                <key>QCON</key>
                <value>11926.1</value>
            </exergy>
        </States>
        <States state="PC10">
            <exergy>
                <key>B1</key>
                <value>146459</value>
            </exergy>
            <exergy>
                <key>B2</key>
                <value>16966</value>
            </exergy>
            <exergy>
                <key>B3</key>
                <value>12190</value>
            </exergy>
            <exergy>
                <key>B4</key>
                <value>257.1</value>
            </exergy>
            <exergy>
                <key>B5</key>
                <value>315.8</value>
            </exergy>
            <exergy>
                <key>B6</key>
                <value>12154</value>
            </exergy>
            <exergy>
                <key>B7</key>
                <value>13059</value>
            </exergy>
            <exergy>
                <key>AIR</key>
                <value>0</value>
            </exergy>
            <exergy>
                <key>WT</key>
                <value>103024</value>
            </exergy>
            <exergy>
                <key>WBC</key>
                <value>58.8</value>
            </exergy>
            <exergy>
                <key>WBA</key>
                <value>910</value>
            </exergy>
            <exergy>
                <key>COMB</key>
                <value>325366</value>
            </exergy>
            <exergy>
                <key>WN</key>
                <value>100000</value>
            </exergy>
            <exergy>
                <key>QCON</key>
                <value>11932.9</value>
            </exergy>
        </States>
        <States state="T84">
            <exergy>
                <key>B1</key>
                <value>147886</value>
            </exergy>
            <exergy>
                <key>B2</key>
                <value>17139</value>
            </exergy>
            <exergy>
                <key>B3</key>
                <value>12381</value>
            </exergy>
            <exergy>
                <key>B4</key>
                <value>259.7</value>
            </exergy>
            <exergy>
                <key>B5</key>
                <value>319</value>
            </exergy>
            <exergy>
                <key>B6</key>
                <value>12273</value>
            </exergy>
            <exergy>
                <key>B7</key>
                <value>13128</value>
            </exergy>
            <exergy>
                <key>AIR</key>
                <value>0</value>
            </exergy>
            <exergy>
                <key>WT</key>
                <value>102973</value>
            </exergy>
            <exergy>
                <key>WBC</key>
                <value>60</value>
            </exergy>
            <exergy>
                <key>WBA</key>
                <value>860</value>
            </exergy>
            <exergy>
                <key>COMB</key>
                <value>328605</value>
            </exergy>
            <exergy>
                <key>WN</key>
                <value>100000</value>
            </exergy>
            <exergy>
                <key>QCON</key>
                <value>12121.3</value>
            </exergy>
        </States>
    </ExergyStates>
    <WasteDefinition>
        <wastes>
            <flow>QCON</flow>
            <type>MANUAL</type>
            <recycle>0</recycle>
            <values>
                <process>CALD</process>
                <value>0.92</value>
            </values>
            <values>
                <process>DESG</process>
                <value>0.08</value>
            </values>
        </wastes>
    </WasteDefinition>
    <Format>
        <definitions>
            <key>EXERGY</key>
            <width>10</width>
            <precision>1</precision>
            <unit>[kW]</unit>
        </definitions>
        <definitions>
            <key>EXERGY_COST</key>
            <width>10</width>
            <precision>1</precision>
            <unit>[kW]</unit>
        </definitions>
        <definitions>
            <key>EXERGY_UNIT_COST</key>
            <width>10</width>
            <precision>4</precision>
            <unit>[J/J]</unit>
        </definitions>
        <definitions>
            <key>GENERALIZED_COST</key>
            <width>10</width>
            <precision>1</precision>
            <unit>[kW]</unit>
        </definitions>
        <definitions>
            <key>GENERALIZED_UNIT_COST</key>
            <width>10</width>
            <precision>4</precision>
            <unit>[J/J]</unit>
        </definitions>
        <definitions>
            <key>DIAGNOSIS</key>
            <width>10</width>
            <precision>2</precision>
            <unit>[kW]</unit>
        </definitions>
    </Format>
</root>